{
  "protocolVersion": "2.7.0",
  "probeVersion": "2.1.0",
  "executedAt": "2026-07-21T19:23:33.8036767+00:00",
  "completedAt": "2026-07-21T19:25:43.4367049+00:00",
  "actualModelCall": true,
  "harmlessPrompt": true,
  "candidateContentExposed": false,
  "approvalPolicy": "never",
  "sandboxMode": "workspace-write",
  "windowsSandbox": "elevated",
  "networkEnabled": false,
  "ignoreUserConfig": true,
  "ignoreRules": true,
  "cliVersion": "codex-cli 0.145.0-alpha.18",
  "cliSha256": "20d611ef1c9851f4da1cb4609beb6763904f72275cb91517b2400639ca1c28c4",
  "model": "gpt-5.4",
  "reasoningEffort": "xhigh",
  "promptSha256": "6a0bfb5c28aea871ab7bece541da24745cd0543a662a8059bffa9887411a0da5",
  "invariantArgv": [
    "-a",
    "never",
    "-m",
    "gpt-5.4",
    "-c",
    "model_reasoning_effort=\"xhigh\"",
    "-c",
    "windows.sandbox=\"elevated\"",
    "-c",
    "sandbox_workspace_write.network_access=false",
    "exec",
    "--ephemeral",
    "--ignore-user-config",
    "--ignore-rules",
    "--skip-git-repo-check",
    "--sandbox",
    "workspace-write",
    "--json"
  ],
  "environmentKeys": [
    "TEMP",
    "TMP",
    "NPM_CONFIG_CACHE",
    "CODEX_DEPENDENCY_ROOT",
    "PORT"
  ],
  "addDirRoles": ["tempRoot", "cacheRoot", "dependencyRoot"],
  "parentCommit": "54a750c5d2171a48d8e4dfd951defbbbeadff236",
  "parentTree": "e7b83b8c8488ae0b930bf96728c883241d371fb6",
  "exitCode": 0,
  "rawJsonlValid": true,
  "threadCount": 1,
  "turnCompleted": true,
  "ordinaryWorkspaceWrite": true,
  "addDirWrites": true,
  "toolExecutionIndependentlyAttested": false,
  "gitMetadataUnchangedBeforeSupervisor": true,
  "privateCanaryUnchanged": true,
  "outsideCanaryUnchanged": true,
  "supervisorCommit": "7896d6aac48bffecf37379b29df0219d5fe4a16e",
  "supervisorCommitExactlyOneChild": true,
  "supervisorCommitClean": true,
  "hooksDisabled": true,
  "valid": true
}
